{
  "feature_id": "FEAT-025",
  "title": "Pane Output Rendering",
  "component": "fugue-client",
  "priority": "P0",
  "status": "new",
  "type": "new_feature",
  "created_date": "2026-01-09",
  "updated_date": "2026-01-09",
  "assigned_to": null,
  "tags": ["tui", "rendering", "terminal"],
  "estimated_effort": "medium",
  "dependencies": ["FEAT-023", "FEAT-022"],
  "description": "Wire ServerMessage::Output data to pane rendering in the client UI. This connects PTY output from the server to the client's terminal emulation and display.",
  "business_value": "high",
  "technical_complexity": "medium",
  "user_impact": "Enables users to see shell output in their terminal panes - core functionality for a terminal multiplexer"
}
