{
  "feature_id": "FEAT-067",
  "title": "Client TCP connection support",
  "component": "fugue-client",
  "priority": "P2",
  "status": "new",
  "type": "new_feature",
  "created_date": "2026-01-13",
  "updated_date": "2026-01-13",
  "assigned_to": null,
  "tags": ["networking", "enhancement", "remote", "client"],
  "estimated_effort": "small",
  "dependencies": ["FEAT-066"],
  "description": "Add TCP connection capability to the fugue client (fugue-client), enabling it to connect to remote daemons over TCP in addition to the default Unix socket. This is Phase 2 of remote peering support, completing the remote workflow by allowing clients to connect to TCP-enabled daemons.",
  "business_value": "high",
  "technical_complexity": "low",
  "user_impact": "Enables remote workflows and cross-machine fugue control. When combined with FEAT-066, allows users to connect fugue client to remote daemons via SSH tunnels, enabling seamless remote session management."
}
