{
  "feature_id": "FEAT-021",
  "title": "Server Socket Listen Loop",
  "component": "fugue-server",
  "priority": "P0",
  "status": "new",
  "type": "new_feature",
  "created_date": "2026-01-09",
  "updated_date": "2026-01-09",
  "assigned_to": null,
  "tags": ["server", "networking", "unix-socket", "async"],
  "estimated_effort": "large",
  "dependencies": [],
  "description": "Implement the main server event loop that listens for client connections on a Unix socket. This is the critical foundation that enables all client-server communication.",
  "business_value": "high",
  "technical_complexity": "medium",
  "user_impact": "Enables clients to connect to the fugue server, which is required for all multiplexer functionality"
}
