{
  "feature_id": "FEAT-035",
  "title": "Configurable Tab/Pane Switching",
  "component": "fugue-client",
  "priority": "P2",
  "status": "new",
  "type": "enhancement",
  "created_date": "2026-01-09",
  "updated_date": "2026-01-09",
  "assigned_to": null,
  "tags": ["input", "keybindings", "navigation", "config", "tui"],
  "estimated_effort": "medium",
  "dependencies": ["FEAT-010", "FEAT-017"],
  "description": "Add keyboard navigation to switch between windows and panes using configurable keybindings. Implement Ctrl+Tab for window cycling and Alt+Tab for pane cycling within the current window, with Shift variants for reverse cycling. All keybindings should be configurable in config.toml.",
  "business_value": "high",
  "technical_complexity": "medium",
  "user_impact": "Provides intuitive, tmux-like navigation between windows and panes with configurable keybindings for power users"
}
